<?xml version="1.0" encoding="UTF-8"?>
<Behavior xmlns:vc="http://www.w3.org/2007/XMLSchema-versioning"
 xmlns:xsi="http://www.w3.org/2001/XMLSchema-instance"
 xsi:noNamespaceSchemaLocation="TTAirBehaviorSchema.xsd" ID="BH003" Log="true" FilePathLog="TTAirbehavior.log">
    <!-- > ########## Lista de Interações mapeadas ##########</-->
    <Interaction ID="INT01" ClassName="org.ttair.proccess.impl.RecognizerHandInFrontIMPL">
        <Name>Hands in Front</Name>
    </Interaction>
    <Interaction ID="INT02" ClassName="org.ttair.proccess.impl.RecognizerFaceIMPL">
        <Name>Face do usuário</Name>
    </Interaction>
    
    <Interaction ID="INT03" ClassName="org.ttair.proccess.impl.RecognizerMousePositionIMPL">
        <Name>Mouse Position LEFT_DOWN</Name>
    </Interaction>
    
    <!-- > ########## Lista de Ações mapeadas ##########</-->
    <Action ID="ACT01" ClassName="org.ttair.action.impl.ActionImpl">
        <Name>IR POWER</Name>
        <Description>Send sign IR Power</Description>
    </Action>
    <Action ID="ACT02" ClassName="org.ttair.action.impl.ActionImpl">
        <Name>IR OK</Name>
        <Description>Send sign IR OK</Description>
    </Action>
    <Action ID="ACT03" ClassName="org.ttair.action.impl.ActionImpl">
        <Name>IR CH+</Name>
        <Description>Send sign IR CH+</Description>
    </Action>
    <Action ID="ACT04" ClassName="org.ttair.action.impl.ActionImpl">
        <Name>IR CH-</Name>
        <Description>Send sign IR CH-</Description>
    </Action>
    
    
    <!-- > ########## Lista de Behavior frames mapeados ##########</-->
    <BehaviorFrame ID="BF01">
        <Name>BF01</Name>
        <Event ID="EVT01" RecognizerID="INT01" Cod="EVTHandInFront">
      		<Name>Mãos para Frente</Name>
    	</Event>
        <ActionID>ACT01</ActionID>
        <ActionID>ACT02</ActionID>
    </BehaviorFrame>
    <BehaviorFrame ID="BF02">
        <Name>BF02</Name>
        <Event ID="EVT02" RecognizerID="INT02" Cod="EVTFaceRecognized">
      		<Name>Face Reconhecida</Name>
    	</Event>
        <ActionID>ACT03</ActionID>
        <ActionID>ACT04</ActionID>
    </BehaviorFrame>
    <BehaviorFrame ID="BF03">
        <Name>BF03</Name>
        <Event ID="EVT03" RecognizerID="INT03" Cod="EVTMousePositionScreenLEFT_UP">
      		<Name>Mouse Esquerda para cima</Name>
    	</Event>
        <ActionID>ACT01</ActionID>
        <ActionID>ACT02</ActionID>
    </BehaviorFrame>
    <BehaviorFrame ID="BF04">
        <Name>BF04</Name>
        <Event ID="EVT04" RecognizerID="INT03" Cod="EVTMousePositionScreenRIGHT_UP">
      		<Name>Direita CIMA</Name>
    	</Event>
        <ActionID>ACT03</ActionID>
        <ActionID>ACT04</ActionID>
    </BehaviorFrame>
    
    
    <!-- > ########## Lista de Expectancies (Expectancy ou contexto)  mapeadas ##########</-->
    <Expectancy ID="exp01">
        <Name>OFF TV</Name>
        <Description>The TV is turned off</Description>
        <BehaviorframeID>BF01</BehaviorframeID>
    </Expectancy>
    <Expectancy ID="exp02">
        <Name>ON TV</Name>
        <Description>The TV is turned on</Description>
        <BehaviorframeID>BF01</BehaviorframeID>
        <BehaviorframeID>BF02</BehaviorframeID>
        <BehaviorframeID>BF03</BehaviorframeID>
        <BehaviorframeID>BF04</BehaviorframeID>
    </Expectancy>
    <Expectancy ID="exp03">
        <Name>EPG TV</Name>
        <Description>The TV is showing the EPG</Description>
        <BehaviorframeID>BF01</BehaviorframeID>
        <BehaviorframeID>BF02</BehaviorframeID>
    </Expectancy>
    <Expectancy ID="expFINAL">
        <Name>FIM</Name>
        <Description>FIM</Description>
    </Expectancy>
    
        
    <!-- > ########## BEHAVIOR CHAIN ##########</-->
    <BehaviorChain ID="BC01">
        <Name>TV Remote Control</Name>
        <Description>Controlling the TV with manual Interactions</Description>
        <ExpectancyID>exp01</ExpectancyID>
        <ExpectancyID>exp02</ExpectancyID>
        <ExpectancyID>exp03</ExpectancyID>
        <ExpectancyID>expFINAL</ExpectancyID>
        <!-- > ########## Lista de transições entre os contextos ou Expectancy(ies) ##########</-->
        <ExpectancyTransition ID="ET001" Source="exp01" Target="exp02">
         <CausedBy>BF01</CausedBy>
        </ExpectancyTransition>
        <ExpectancyTransition ID="ET002" Source="exp02" Target="exp01" >
         <CausedBy>BF01</CausedBy>
         </ExpectancyTransition>
        <ExpectancyTransition ID="ET003" Source="exp03" Target="exp01">
         <CausedBy>BF01</CausedBy>
        </ExpectancyTransition>
        <ExpectancyTransition ID="ET004" Source="exp02" Target="exp03">
         <CausedBy>BF04</CausedBy>
         </ExpectancyTransition>
        <ExpectancyTransition ID="ET005" Source="exp03" Target="exp02">
         <CausedBy>BF02</CausedBy>
         </ExpectancyTransition>
         <ExpectancyTransition ID="ET006" Source="exp03" Target="expFINAL">
         <CausedBy>BF01</CausedBy>
         </ExpectancyTransition>
    </BehaviorChain>
  
</Behavior>
