<?xml version="1.0" encoding="UTF-8"?>
<Behavior xmlns:vc="http://www.w3.org/2007/XMLSchema-versioning"
 xmlns:xsi="http://www.w3.org/2001/XMLSchema-instance"
 xsi:noNamespaceSchemaLocation="TTAirBehaviorSchema.xsd" ID="BH002" Log="false" FilePathLog="TTAirbehavior.log">
  <Interaction ID="INT01" ClassName="org.ttair.proccess.impl.RecognizerKinectHandPoint">
    <Name>AA01</Name>
    <Description>XX01</Description>
  </Interaction>
  <Interaction ID="INT02" ClassName="org.ttair.proccess.impl.RecognizerMousePositionIMPL">
    <Name>AA02</Name>
    <Description>XX02</Description>
  </Interaction>
  <Action ID="ACT01" ClassName="org.ttair.action.impl.ActionImpl">
    <Name>Acao ligar lampada</Name>
    <Description>ACT 01</Description>
  </Action>
  <Action ID="ACT02" ClassName="org.ttair.action.impl.ActionImpl">
    <Name>Acao ligar lampada</Name>
    <Description>ACT 02</Description>
  </Action>
  <BehaviorFrame ID="BF01">
    <Name>Behavior Frame 01</Name>
    <Event ID="EVT01" RecognizerID="INT01" Cod="EVTHandRightUP">
      <Name>Evento de mãos para cima</Name>
    </Event>
    <ActionID>ACT01</ActionID>
    <ActionID>ACT02</ActionID>
  </BehaviorFrame>
  <BehaviorFrame ID="BF02">
    <Name>Behavior Frame 02</Name>
    <Event ID="EVT02" RecognizerID="INT02" Cod="EVTMousePositionScreenRIGHT_DOWN">
      <Name>Evento de mãos para baixo</Name>
    </Event>
    <ActionID>ACT01</ActionID>
  </BehaviorFrame>
  <Expectancy ID="EXP01">
  	<Name>Expectancy 01</Name>
    <Description>Expectancy Nivel 01: Utilizada para iniciar a aplicação.</Description>
    <BehaviorframeID>BF01</BehaviorframeID>
  </Expectancy>
  <Expectancy ID="EXP02">
  	<Name> Expectancy 02</Name>
    <Description>Expectancy Nivel 02: Estado de expectativa após se iniciado o ambiente</Description>
    <BehaviorframeID>BF02</BehaviorframeID>
  </Expectancy>
  <BehaviorChain ID="BC001">
    <Name>Bc Tv</Name>
    <Description>Behavior Chain de TV</Description>
    <ExpectancyID>EXP01</ExpectancyID>
    <ExpectancyID>EXP02</ExpectancyID>
    <ExpectancyTransition ID="ETR01" Source="EXP01" Target="EXP02">
      <CausedBy>BF01</CausedBy>
    </ExpectancyTransition>
    <ExpectancyTransition ID="ETR02" Source="EXP02" Target="EXP01">
      <CausedBy>BF02</CausedBy>
    </ExpectancyTransition>
  </BehaviorChain>
</Behavior>