<?xml version="1.0" encoding="UTF-8"?>
<Behavior xmlns:vc="http://www.w3.org/2007/XMLSchema-versioning"
 xmlns:xsi="http://www.w3.org/2001/XMLSchema-instance"
 xsi:noNamespaceSchemaLocation="TTAirBehaviorSchema.xsd" ID="BH004" Log="true" FilePathLog="TTAirbehavior.log">
  <Interaction ID="INT01" ClassName="org.ttair.proccess.impl.RecognizerMousePositionIMPL">
    <Name>INT01</Name>
    <Description>Interação que captura a posição do mouse na tela</Description>
  </Interaction>
 
  <Action ID="ACT03" ClassName="org.ttair.action.impl.ShowInconHouseC2">
    <Name>Seleciona Comodo 2</Name>
  </Action>
  <Action ID="ACT04" ClassName="org.ttair.action.impl.ShowInconHouseC3">
    <Name>Seleciona Comodo 3</Name>
  </Action>
  <Action ID="ACT05" ClassName="org.ttair.action.impl.ShowInconHouseC4">
    <Name>Seleciona Comodo 4</Name>
  </Action>
  <Action ID="ACT06" ClassName="org.ttair.action.impl.ShowInconHouseC5">
    <Name>Seleciona Comodo 5</Name>
  </Action>
  
  
  <BehaviorFrame ID="BF01">
    <Name>Behavior Frame 01</Name>
    <Event ID="EVT01" RecognizerID="INT01" Cod="EVTMousePositionScreenRIGHT_DOWN">
      <Name>Direita Baixo</Name>
    </Event>
    <ActionID>ACT06</ActionID>
  </BehaviorFrame>
  <BehaviorFrame ID="BF02">
    <Name>Behavior Frame 02</Name>
    <Event ID="EVT02" RecognizerID="INT01" Cod="EVTMousePositionScreenRIGHT_UP">
      <Name>Direita Cima</Name>
    </Event>
    <ActionID>ACT04</ActionID>
  </BehaviorFrame>
  <BehaviorFrame ID="BF03">
    <Name>Behavior Frame 03</Name>
    <Event ID="EVT03" RecognizerID="INT01" Cod="EVTMousePositionScreenLEFT_DOWN">
      <Name>Esquerda Baixo</Name>
    </Event>
    <ActionID>ACT05</ActionID>
  </BehaviorFrame>
  <BehaviorFrame ID="BF04">
    <Name>Behavior Frame 04</Name>
    <Event ID="EVT04" RecognizerID="INT01" Cod="EVTMousePositionScreenLEFT_UP">
      <Name>Esquerda Cima</Name>
    </Event>
    <ActionID>ACT03</ActionID>
  </BehaviorFrame>
  
  
  <Expectancy ID="EXP01">
  	<Name>Expectancy 01</Name>
    <Description>Expectancy Nivel 01: Utilizada para iniciar a aplicação.</Description>
    <BehaviorframeID>BF01</BehaviorframeID>
  </Expectancy>
  <Expectancy ID="EXP02">
  	<Name> Expectancy 02</Name>
    <Description>Expectancy Nivel 02: Estado de expectativa após se iniciado o ambiente</Description>
    <BehaviorframeID>BF02</BehaviorframeID>
  </Expectancy>
  <Expectancy ID="EXP03">
  	<Name> Expectancy 03</Name>
    <Description>EXP03 de teste</Description>
    <BehaviorframeID>BF03</BehaviorframeID>
  </Expectancy>
  <Expectancy ID="EXP04">
  	<Name> Expectancy 04</Name>
    <Description>EXP 04</Description>
    <BehaviorframeID>BF04</BehaviorframeID>
  </Expectancy>
  <BehaviorChain ID="BC001">
    <Name>Bc Tv</Name>
    <Description>Behavior Chain de TV</Description>
    <ExpectancyID>EXP01</ExpectancyID>
    <ExpectancyID>EXP02</ExpectancyID>
    <ExpectancyID>EXP03</ExpectancyID>
    <ExpectancyID>EXP04</ExpectancyID>
    <ExpectancyTransition ID="ETR01" Source="EXP01" Target="EXP02">
      <CausedBy>BF01</CausedBy>
    </ExpectancyTransition>
    <ExpectancyTransition ID="ETR02" Source="EXP02" Target="EXP03">
      <CausedBy>BF02</CausedBy>  
    </ExpectancyTransition>
    <ExpectancyTransition ID="ETR03" Source="EXP03" Target="EXP04">
      <CausedBy>BF03</CausedBy>  
    </ExpectancyTransition>
    <ExpectancyTransition ID="ETR04" Source="EXP04" Target="EXP01">
      <CausedBy>BF04</CausedBy>  
    </ExpectancyTransition>
  </BehaviorChain>
 
</Behavior>